{
  "last_updated": 1606727710,
  "ttl": 300,
  "version": "2.2",
  "data": {
    "en": {
      "feeds": [
        {
          "name": "gbfs_versions",
          "url": "https://test.com/gbfs_versions"
        },
        {
          "name": "system_information",
          "url": "https://test.com/system_information"
        },
        {
          "name": "vehicle_types",
          "url": "https://test.com/vehicle_types"
        },
        {
          "name": "station_information",
          "url": "https://test.com/station_information"
        },
        {
          "name": "station_status",
          "url": "https://test.com/station_status"
        },
        {
          "name": "free_bike_status",
          "url": "https://test.com/free_bike_status"
        },
        {
          "name": "system_regions",
          "url": "https://test.com/system_regions"
        },
        {
          "name": "system_pricing_plans",
          "url": "https://test.com/system_pricing_plans"
        },
        {
          "name": "system_hours",
          "url": "https://test.com/system_hours"
        },
        {
          "name": "system_calendar",
          "url": "https://test.com/system_calendar"
        },
        {
          "name": "system_alerts",
          "url": "https://test.com/system_alerts"
        },
        {
          "name": "geofencing_zones",
          "url": "https://test.com/geofencing_zones"
        }
      ]
    }
  }
}